,text,link,type,created_mst
61,"My hospital visit today Ended up in hospital around 2.30pm today (I’m writing this as of 9.50pm Sunday night) because of a very excruciating endo flare. I had been very sick and throwing up over the last 48 hours and half of today was just dry heaving. I ended up having a shower to try and relieve some of the pain and ended up dry heaving more to the point my throat was burning and my head was throbbing. I ended up calling my mum to ask for help getting to the hospital and once there I was seen and put into a ward within the first 15 minutes of arriving (this is absolutely wonderful considering I’ve spent 6 hours in the waiting room alone). They took my bloods, urine test, etc. the normal stuff. And eventually put me on an IV drip cause I was too dehydrated. Today’s visit is so different from any others because the doctor who saw me (his name tag said his name was Ian) talked to me like I was an actual patient, like I was a sane human being who was actually in pain and unwell and believed me. He talked to me about his knowledge of endometriosis, my history with it and gave me advice on the best ways to be taking my medications. He also said it won’t necessarily be a miracle worker doing it this way or the way I was doing it before but it is worth a try. He knows it a chronic illness, he knows it’s incurable and he wasn’t trying to tell me that things will get better if I do a, b and c. Most doctors talk to me like I’m crazy and it’s all in my head that I leave the hospital in the same amount of pain if not more and extremely frustrated and angry because of the lack of knowledge or understanding or acceptance that DOCTORS have on this. But instead of being talked DOWN to he talked to me. He asked what I was feeling and what I wanted out of this. Apart from my GP he has been the best doctor I have seen. My pain went from a 12 out of 10 to an 8 out of 10 (which I know is still pretty high on the scale but on a day to day that is normal or average for me), it when down 4 units on the scales cause he took me seriously and listened to me and actually helped me. Instead of giving me pain killers I’ve already taken that weren’t working, hence going into hospital for additional help, he gave me oxycodone which is a strong pain killer I’ve never had before and it brought my pain down. Now that I am home, I’m just really drowsy and want to sleep but I wanted to share how happy I am to be listened too finally",/r/Endo/comments/fiyk26/my_hospital_visit_today/,submission,2020-03-15 03:01:27-06:00
62,"Bleeding, Spotting, Increased Pain &amp; Symptoms After Being on Orilissa? I'll be writing a seperate post later on about the experience of being on Orilissa, as well as more details about symptoms that happened/increased after going off, but right now I'm checking to see if anyone else was on it and had/has the same experience I have. I know surgery is best, but I was desperate for even a band-aid at the time.      I was on it for 6 months, the highest dose twice a day, I went off it in...December, I believe it was, and had a period for the first time in 6-7 months. Naturally it was two weeks long, which I sort of expected. Before my period, endo symptoms flared up worse than ever, and continued for months, completely taking over my life. Pain ended up being more debilitating than before. So much for Abbvie saying they think this could eliminate symptoms afterwards, at least for me. I had been skeptical of that claim, anyways.      One of the more worrying symptoms is that I used to have a fairly regular period, heavy, yes, but regular. Now I just end up bleeding, spotting, having full on periods sometimes whenever. I'll finish a period, wait a few more days to be sure, go back on pill, then about 5 days later, start bleeding again. So I've been having something like that going on at least half the time for 3 months, that has never happened. I expected things to be a little wonky afterwards, but does that part ever get better?",/r/Endo/comments/fixvfu/bleeding_spotting_increased_pain_symptoms_after/,submission,2020-03-15 01:46:44-06:00
63,Switching off Norethindrone to another alternative? ,/r/Endo/comments/fiwiec/switching_off_norethindrone_to_another_alternative/,submission,2020-03-14 23:25:46-06:00
64,"What do you wish you had asked your doctor when you first started this journey? Going for the first time soon I'm having my first official doctor's appointment specifically to diagnose my Endo. I've had other doctors tell me in the past that they think it's the issue, but I've never been tested or seen a specialist. I've done endless research because for the longest time I didn't know what was wrong with me. When I found out what Endo was, it felt like someone was explaining my life to me, unfortunately.   I've suspected for a long time, but I also have little faith in doctors as I have never been actually heard or listened to, for this illness or any other issue I was facing.   The doctor I'm seeing was reccomnded to me, and it has been getting so bad that I cannot take this lifestyle any more. I don't want to live with this pain, it's affecting my life, my relationships, my work, my mental health, my sex life. Every aspect of my existence is touched by this.   My questions to you are, what is your advice on speaking to my doctor for the first time? I am going to have a consultation and an ultrasound. Are there questions you wish you asked when you were in the beginning stages? What should I know about this process?   Mainly, I want to know what I should ask of my doctor, or make sure she takes into consideration, etc.   I know ever case is different, but I thank you all in advance for your replies.",/r/Endo/comments/fivyfl/what_do_you_wish_you_had_asked_your_doctor_when/,submission,2020-03-14 22:37:17-06:00
65,Has anyone had any concerns about endo and COVID-19? Please do not let this post cause you any panic.   I did some digging on wether or not endo is considered an immune disease and found that nothing is certain on it but studies to suggest that it can affect our immune system and women who have this are more likely to develop immune disorders like lupus. This is really not sitting well with me during a pandemic. Does anyone have any concerns or information that they’ve received from their doctors about this?,/r/Endo/comments/fivvdn/has_anyone_had_any_concerns_about_endo_and_covid19/,submission,2020-03-14 22:30:08-06:00
66,"Can you get Back/Leg pain from endo?? I'm 18, my family has a heavy history of endo, though I've never been diagnosed. I only ever remember having 1 painless period, and that was my first one. I have severe cramping in my lower back, shooting pelvic pain, bloating, irregular periods, and I have to be careful putting in a tampon in because it physically hurts. I always suspected I had endo because of this, but was too nervous to ask for a gynecologist and my pediatrician at the time told me to get over it.   However, I have also had lower back pain and leg pain for about 5 years now. I got an x-ray done of my back and leg, and nothing came up. I also got an ultrasound of my kidneys done because my family also has a history of kidney issues and they wanted to rule that out as the cause, too.   Browsing this sub, I saw some people complaining of back pain and it made me wonder.... I've had this back and leg pain, maybe this is the cause? It feels like a nerve problem, I get kinda weak and wobbly...If you have back or leg pain and had endo, what does it feel like?  Would it be worth mentioning to my doctor?",/r/Endo/comments/fiuqhk/can_you_get_backleg_pain_from_endo/,submission,2020-03-14 21:01:17-06:00
67,Issues after Lap Has anyone had any issues with bellybutton becoming inflamed and irritated months after laparoscopy?,/r/Endo/comments/firovm/issues_after_lap/,submission,2020-03-14 17:25:35-06:00
68,"at what age were you diagnosed? I'm only 17 about to me 18 next month. my Dr recently diagnosed me with endometriosis without having any surgery (idk what it's called sorry). I've always had problems with my periods even the whole Shazam. tons of ER visits, and searching for a dr that would take me seriously. I have all the signs of Endo and not to mention my mom has really bad Endo so I've heard it's hereditary. these aren't just horrible periods I'm always having random abdominal pain especially when drinking anything (hot/cold), even going to the bathroom leaves me with pain, especially after intercourse I end up having to lay down with a heating pad. I was wondering at what age you guys got diagnosed? ik it's can't be actually confirmed till they go and check with surgery but my Dr says we need to try the treatment and if it doesn't help then we have to check. please no hate",/r/Endo/comments/fiqheg/at_what_age_were_you_diagnosed/,submission,2020-03-14 16:05:51-06:00
69,"I feel ashamed for having endo sometimes. I just had to leave work because of nearly vomiting in front of customers. My boss also has endo and she understood, but I couldn’t help but still feel like I’m such an inconvenience to people when I’m dealing with this awful stage of my period.  I’m going to give my doctor a call today. I think I’ve finally had enough with this ruining my life. The sore breasts, the painful intercourse, the extreme nausea and vomiting, the amount it just causes my life to become such a horrific experience in a matter of hours. It makes me want to sob for hours at a time. It’s such a devastating disease and I feel like nobody really understands.  Hopefully I can see my doctor today. I’m quite literally at a breaking point.",/r/Endo/comments/fiq6hj/i_feel_ashamed_for_having_endo_sometimes/,submission,2020-03-14 15:46:44-06:00
70,"I haven’t been diagnosed but I think I’m in the right place Just a bit of history.  At 14 I was diagnosed with PCOS. I was 135 lbs. By 18 I was 155 and told I was overweight and I hadn’t been having my period for over a year. By 19 I was diagnosed with infertility, told I was obese and I hadn’t even hit 180 yet. From 19 to now 25 I’ve started having irregular periods. At 22 I started getting my period but it would last for 3 months and be super heavy. At 23 I went is for my menorrhagia and pelvic pain and had a doctor tell me it was be I was obese and tried to put me on the Nuvaring and refused to even do a pelvic exam when that’s what I came in for to begin with. I tied the nuvaring after my period ended and it caused so much pain and the bleeding was way worse. I can’t even describe it. My father had to drive me to the hospital it was so bad.  The thing is I’ve gone to the doctor for years and all they’ve done is chalk it up to PCOS. I’ve been regularly having insomnia since a teen. Yet always tired and fatigued. As well as migraines once a week since I was a 14. My cramps use to be so painful I couldn’t move but now I’m so use to them that small cramps feel like nothing. I’ve never been able to enjoy sex because it causes me pain to even have something in there. And now here I am at 25, and apparently obese at 235 lbs, no matter how much I try to diet and limit how much I eat.   I’ve know about endo but I’ve always seen that it’s super painful, so I just figured I didn’t have it because I felt my pain should be way worse than what I’ve experienced. However as of last night, after a lot of research I’m finally starting to believe that’s what this is. I feel like I want to cry to have found out a reason for all the medical problems.   I’m sorry if all of this comes off convoluted I’m just so overwhelmed. I guess I’m writing because I just need to know if all the things I’ve said I’ve gone through sounds like endo? And if it does, what can I do to get diagnosed? What do I need to say specifically to get my doctors to listen?",/r/Endo/comments/fip3lj/i_havent_been_diagnosed_but_i_think_im_in_the/,submission,2020-03-14 14:38:12-06:00
71,"8 months on Visanne, 4 more to go. I’ve never been more depressed in my life. Even loved ones are losing patience and I can’t help it. Moods come and go, Visanne made me borderline bipolar.       Just wish me luck, girls. Wishing you all the strength in the world, ours is a tough one.",/r/Endo/comments/finahz/8_months_on_visanne_4_more_to_go_ive_never_been/,submission,2020-03-14 12:48:09-06:00
72,"Post-Lap - incredibly nauseous and unsure if I'm bleeding too much I got my lap on wednesday, where I had some suspected endo excised (not extensive but it was there). Incision and general pain wise I've been doing better every day, however I'm having some bad symptoms and am wondering if I should contact my doctor.  I am incredibly nauseous for no reason. I make sure to take all my meds with food, and have generally stuck to soups, jello, appelsauce, toast etc. However I've gotten these terrible waves of nausea that won't go away and are much worse than what I normally get when I'm reacting to pills. Is severe nausea something I'm just going to have to deal with for a while or something I should contact my doctor about?  Second, I've been bleeding. Which I know on it's own is perfectly normal after a lap but mine is getting worse and is starting to become more like a normal period for me, and my normal periods are heavy. They did say some meds could mess with my bc pills, but my bc 'periods' are very light compared to normal. Again, unless I'm gushing blood, is this something I just have to wait out or should I call my doctor?",/r/Endo/comments/fimv9t/postlap_incredibly_nauseous_and_unsure_if_im/,submission,2020-03-14 12:22:51-06:00
73,Another Lupron injection on Monday. Wish me luck y’all. I know I’m going to feel like shit for a few days. My symptoms started popping up again a couple days ago. I haven’t decided which is worse. The endo pain or the side effects from the injection.,/r/Endo/comments/filxf5/another_lupron_injection_on_monday/,submission,2020-03-14 11:25:09-06:00
74,"Feeling really down. Hey so I’m 2 weeks and 2 days post my first lap. I had the coil put in as well and left with a diagnosis of mild endo.  Over the last few weeks my body has worked miracles! I’m so proud of my body for working so hard to get me where I am right now and I’m definitely on the mend physically.   Now I’ve always dealt quite badly with hormonal contraceptives but I was recommended the coil by so many people and I had done tonnes of research. I’m still worried that it’s causing me to feel really teary and just generally don’t wanna get out of bed even though I can now! I’m not sure whether to put this down to the coil, the aftermath of the trauma or everything else going on in my life (family deaths).   I can’t begin to pin point why I might be feeling this way but it sucks. I just want to be happy and I thought that’s what this surgery would give me. Why can’t I just be happy?",/r/Endo/comments/filrjn/feeling_really_down/,submission,2020-03-14 11:15:14-06:00
75,"Acne? I’ve been on Orilissa for almost 6 months now and my acne is completely out of control. Anyone have any advice on this? I’ve been using Paulas Choice 2% BHA exfoliant which is supposed to help with acne but I haven’t noticed a difference.  When I was on birth control my acne was much less crazy, but since going on Orilissa it’s been awful.",/r/Endo/comments/fiksjf/acne/,submission,2020-03-14 10:15:05-06:00
76,"has anyone else experienced this? spasms in uterus, vaginal canal, lower back, rectum, pain with urination not associated with a UTI or other infection, weakness/pain in legs?   &amp;#x200B;  I am suffering so hard today while trying to study for 6 exams in PA school. I am so miserable. nothing is helping",/r/Endo/comments/fikjae/has_anyone_else_experienced_this/,submission,2020-03-14 09:59:20-06:00
77,"How are women being diagnosed without a laparoscopy? I'm so confused. I've always been told, since I was diagnosed, you cannot see endometriosis on an ultrasound or any other image. Laparoscopy is the only way to diagnose endo from what I was told so I am unsure on how so many women are diagnosed via ultrasound or anything else.  So i guess its confusing cuz to me I was told not to trust imaging because it's not a diagnostic tool for Endo. From my understanding the only way to know from imaging is if the ultrasound shows an endometrioma   *Endometriosis lesions are difficult or often impossible to detect using non-invasive imaging techniques, such as ultrasounds, so doctors must do a laparoscopy to make a diagnosis.* [Most articles say the same thing upon researching. ](https://www.medicalnewstoday.com/articles/322469)   How are so many diagnosed via imaging?",/r/Endo/comments/fihig5/how_are_women_being_diagnosed_without_a/,submission,2020-03-14 06:20:27-06:00
78,"Just a reminder that negative imaging does NOT mean there’s nothing there. I had my first ultrasound and CT scan at age 20 due to lower right abdominal pain.   Over the next 9 years I had approximately 10 -12 ultrasounds, CT scans, one endoscopy, one MRI, 3 different OBGYNS, 3 primary care doctors, one amazing pelvic floor physical therapist, and I couldn’t even begin to name or count the amount of doctors and nursed I saw in the ER.   All of this imaging was negative. I was told it was gas, cramps, anxiety, attention seeking, and eating disorder, and/ or drug seeking. I was told I was working too much, under too much stress. I was told I was too lazy and a good walk and yoga would help.",/r/Endo/comments/fid9ze/just_a_reminder_that_negative_imaging_does_not/,submission,2020-03-13 22:54:29-06:00
79,"Two Weeks Post Cystectomy https://imgur.com/a/6jX1zTm  TLDR: Had a 9x6x7 cm endometrioma removed from my left ovary.   Back in October, I started having pain with deep penetration during sex, as well as a dull achiness in my pelvis right around ovulation. I set up an appointment with my gynecologist who suspected two small (3-4 cm) functional cysts on my left ovary. An ultrasound showed 1 large 9x6x7cm cyst, as well as a smaller 2 cm cyst. My gynecologist still suspected functional cysts and recommended a wait-and-see approach for 6 weeks. A follow-up ultrasound showed no change in the cysts. This is when the words “endometriosis” and “endometrioma” began being used. Surgery was scheduled for the end of February.   Through all of this, my only pain was with deep penetration, and the dull achiness right around ovulation. I had no change in my periods (which are not heavy, last 3-4 days, are consistent, and are not super crampy or painful).   Surgery time arrived, and it was 2 endometriomas on my left ovary. Apparently the larger was adhered to my uterus and pushing down on my cervix. She also ablated some small areas of endometriosis on my bladder and uterus.   Recovery has been amazing. I have 3 small lap sites, pain was well controlled with Ibuprofen, and I actually returned to work 3 days post-op (I’m an RN). I was able to start running again after 7 days with minimal discomfort (I’m a little slower) and started weightlifting again 2 weeks post-op.   For reference, I’m a 34 year-old, G0P0",/r/Endo/comments/fi9piy/two_weeks_post_cystectomy/,submission,2020-03-13 18:14:57-06:00
80,"Any informative laparoscopy or excision videos available online? Hi all! I’ve seen most of the surgical videos available on YouTube,  was wondering if anyone knew any videos that detailed the surgical process a little better or maybe videos of the actual laps themselves?",/r/Endo/comments/fi8xd3/any_informative_laparoscopy_or_excision_videos/,submission,2020-03-13 17:20:30-06:00
81,"Post excision soreness where lesions were? I had my first lap about a week and a half ago (March 3rd.) in the past couple days I’ve been sore in my hip where I know there was a lot of endo. It would make sense to me for this area to be sore as it heals, but then there’s part of me that worries it means something got missed.     Do any of you have experience with something like this?",/r/Endo/comments/fi65cy/post_excision_soreness_where_lesions_were/,submission,2020-03-13 14:22:56-06:00
82,"Lap and afterwards See my post history for past posts.   I had a diagnostic laparoscopy 2 weeks ago looking for endo or anything to explain severe pain I've been suffering with the past two years.  I get detailed results next week. From my understanding (the consultant looking after me didnt talk to me after surgery). On the letter it says they only found a cyst on my left ovary which he aspirated and is testing as routine. No endo found, no diagnosis made.  The consultant told my mum the pain looks to be coming from my bowel. Previously he had thought this was the case so referred me to a Bowel specialist. I had all the tests done and the Bowel specialist said everything was normal and that I should be referred to gynae as it appeared to be gynae related pain.   My concern is that I have pain still and blood clots have started coming out yesterday. I'm also scared to have a period again because every period is agony and every time since this started its been getting worse and worse. They have photos of the lap. If I'm able to get a copy of them then I want to take it to a private specialist. I feel like it cant be nothing if my periods cause me that much pain and I trust the consultant that told me it wasnt bowel related more than him. The gynae consultant did notice a level of inflammation in my blood tests which spikes up every time I get pain like this.",/r/Endo/comments/fi5x2r/lap_and_afterwards/,submission,2020-03-13 14:08:59-06:00
83,"Pain History / Bleeding Between Cycles - Endo Symptom? (Kind of long) Hello, I'm 28 and I have my first appointment to address my symptoms next week, but basically since I was 12 I've had debilitating period cramps and heavy flow. Birth control only helps a bit. 6 months ago I started getting extreme, can't talk, can't stand, can't sit, can't walk pain in the right side of my uterus area and right side of my lower back. I get migraines too. I also have pain extend down into the top/groin part of my right leg. All of this pain always happens towards the end of my period and a week or so after. I also get constipation, or what feels like it, and when I went to the ER twice and had CT scans, they can only find moderate stool and I'm sent home with advice on fiber. I recently had extreme pain at the end of my period and really bad pain 3 days after my last day. Yesterday (3/12) I went to the bathroom and found blood in my underwear, the amount similar to like day 5 or 6 on a period, but my period ended on 3/4. Is it a symptom to bleed between periods with Endo? I was also worried about pregnancy, but I'm on birth control and use condoms and my last intercourse was 2/23 before my period started on 2/26.   I'm scared and just undiagnosed and I just need other people with Endo to talk to about this. :(",/r/Endo/comments/fi5nnr/pain_history_bleeding_between_cycles_endo_symptom/,submission,2020-03-13 13:52:31-06:00
84,"Lap AND Umbilical Hernia Repair - Has Anyone Had Both? I finally have my lap scheduled but once the doctor told me she’d make an incision under the bellybutton, I informed her that I was born with an umbilical hernia and showed her. She said she could fix it during my surgery.   I just wanted to know what recovery looks like and how much pain I’m looking at here. Having a two-for-one special does NOT sound fun, and I’m already anxious about missing two weeks minimum of work because of the lap so I’m not sure how much the hernia repair will set me back (I’ve heard SIX WEEKS)  Have any of you had a hernia repair or know someone who has had one? Any tips on recovery and pain management would be lovely.",/r/Endo/comments/fi5g4j/lap_and_umbilical_hernia_repair_has_anyone_had/,submission,2020-03-13 13:39:38-06:00
85,"25, severely mentally ill &amp; waiting for diagnosis... can anyone sympathise or give advice? ",/r/Endo/comments/fi4urs/25_severely_mentally_ill_waiting_for_diagnosis/,submission,2020-03-13 13:03:17-06:00
86,"Not quite pain, just discomfort Anyone else get this? I had a few days of bad cramps and now they've subsided but I'm still really uncomfortable all the time. I wouldn't describe it as ""pain"" as such, just like a general discomfort in my back and my pelvis. Constantly.",/r/Endo/comments/fi0lj2/not_quite_pain_just_discomfort/,submission,2020-03-13 08:36:54-06:00
