,text,link,type,created_mst
0,Finally made an appointment I’ve been diagnosed with endometriosis. I of course had ablation surgery before I knew that it wouldn’t work. I’ve been putting off seeing an excision specialist for some time now.   Yesterday I took off my shirt and had blood coming from my belly button. That was my last straw. I can actually SEE my disease now. I’m done. I called Dr. Ann Peters in Maryland today.   Has anyone else seen her?,/r/Endo/comments/fl3aje/finally_made_an_appointment/,submission,2020-03-18 21:41:39-06:00
1,"What are the chances of me being seen by emergency doctors amid the Corona Virus chaos? I’m 19. I’ve been diagnosed for 2 years. Today is the worst pain I’ve ever been in, and I have no medications that will help. I’m actually thinking of going to the hospital, but will they even see me? It’s also the first day of my period, but I just can’t seem to deal with this pain. Any thoughts or tips would be appreciated.",/r/Endo/comments/fl1o0j/what_are_the_chances_of_me_being_seen_by/,submission,2020-03-18 19:47:04-06:00
2,"Belly Button Blood Belly button blood is a new symptom for me. Last month it was dry and crusty before I realized there was any blood.  This month it is actively bleeding. Has this happened to any of you?    It’s not really hurting at the moment, but the idea of actively bleeding is driving me nuts.",/r/Endo/comments/fl0b8m/belly_button_blood/,submission,2020-03-18 18:17:27-06:00
3,"How do you combat feeling ""useless""? Hi Ladies - I've been dealing with a month long flare following bronchitis/made worse by anxiety, and I'm struggling to keep up with work and study. I've been unable to stay awake or out of bed for several days at a time. You know the drill!   Of course, having a chronic illness that does this to you can have you reminiscing over the life you used to live before your health crumbled. I can't eat/do/experience the things I used to or perform at the same level. How many of you have experienced feeling useless or like a waste of space? How have you dealt with this?   I hope you're all coping as well as possible in the current pandemic situation/s 💛",/r/Endo/comments/fkyssw/how_do_you_combat_feeling_useless/,submission,2020-03-18 16:41:11-06:00
4,"Morphine??? Let's be honest, ibuprophen, paracetamol and shit like that doesn't even begin to tickle endo pain.   Every time I have gone to the ER they wanted to give me morphine and my mom didn't let them so I suffered and screamed and cried and squirmed like I'm being burned at the stake, until it passed, which sometimes took 12 hours or more.  I know this has happened to many girls and I just really want to know if it actually helped when you took it? And what were the side effects you experienced? And how many times have you taken it for endo pain?",/r/Endo/comments/fkyruo/morphine/,submission,2020-03-18 16:39:37-06:00
5,Endometriosis linked to weak immune system? I was diagnosed with Endo 2 years ago when i was 16. but I’ve always been really weak and got sick easily. Do other with endo experience this? Or might i have something not related?,/r/Endo/comments/fkxvme/endometriosis_linked_to_weak_immune_system/,submission,2020-03-18 15:46:21-06:00
6,Ibuprofen &amp; COVID-19 symptoms PSA! ,/r/Endo/comments/fkxepk/ibuprofen_covid19_symptoms_psa/,submission,2020-03-18 15:18:51-06:00
7,"Decided to get off the pill Around 6 months ago I was diagnosed with endometriosis based on my symptoms. I used to be bloated more than half the time each month and I had painful periods. The doctor told me to start taking contraception, as is the only way to slow down the disease and stop the symptoms.  I was reluctant at first, but I was also afraid of how the desease might progress otherwise, so I started taking the pill.   First 3 months were pretty unstable as I used to have nausea and I remember waking up just to throw up. Then I slowly realised that I was a mess emotionally. Really moody, sometimes depressed. Even though the nausea stopped, my emotional health deteriorated. I was happy that I didn't have to take painkillers during periods anymore, which were pretty light. Also bloating was becoming something of the past. But at the same time I felt like I was loosing all control over my life, my emotions, my whole being.   I started contemplating the idea of getting off the pill so I can gain back control over what and how I feel. Last period was the final trigger. The bloating was so bad, I felt like the before-the-pill days were back. So I said, if the pill is messing with my brain and it's not relieving my physical symptoms either, then I'm not starting a new pack.  So here I am, 10 days off the pill. I feel some discomfort on the left side of my pelvis, a bit bloated here and there. I'm looking now into changing my diet, reducing stress and trying to sleep better so I can fight this deasese at the root. I suspect the cause to be hormonal imbalance, and I hope I can find my equilibrium one day. Let me know if any of you managed to improve your life this way.  Good luck to anyone struggling with endo pain these days! Stay strong.",/r/Endo/comments/fkw6gd/decided_to_get_off_the_pill/,submission,2020-03-18 14:08:27-06:00
8,"How often do you go to the gyno? So I was just diagnosed with endo within the last year but I’ve had it for about 5 years. I went to the gyno for the first time this past summer and it has only been about 6 months since that initial visit and I was sent a postcard saying it was time for my next appt. I know people usually go once per year, but is it commonplace for people with endo to go every 6 months instead?",/r/Endo/comments/fkvbdl/how_often_do_you_go_to_the_gyno/,submission,2020-03-18 13:18:25-06:00
9,"Why am I being referred to a gastroenterologist? Apologies if this is a stupid question but...  I finally saw an endometriosis specialist today and they said whilst the ultrasound I had signaled I didn't have advanced endo, they can't rule out me having endo at all. They said a laparoscopy would be good but won't be happening anytime soon due to coronavirus.   Instead, they recommended seeing a gastroenterologist in the meantime to rule out pain being caused by a bowel problem. Except, I have no bowel related symptoms at all. I've tried gluten free and dairy free and my pain didn't noticeably change. Why then would I need to waste time and energy doing this?   Apologies if I'm being obtuse.",/r/Endo/comments/fkux1s/why_am_i_being_referred_to_a_gastroenterologist/,submission,2020-03-18 12:55:35-06:00
10,Avila Romm answering questions live today ,/r/Endo/comments/fku79l/avila_romm_answering_questions_live_today/,submission,2020-03-18 12:14:17-06:00
11,"Can endo cause low blood pressure? Two days ago my blood pressure hit the floor and I started fainting and dry heaving, and couldn’t really move. Now I’m doing a little better but my blood pressure won’t come up very far and I still can’t keep any food in my stomach. Could this be caused by Endo?",/r/Endo/comments/fktppw/can_endo_cause_low_blood_pressure/,submission,2020-03-18 11:47:22-06:00
12,"Trouble keeping food down? Ever since my pain got worse I’ve had a really difficult time eating/keeping food in my stomach. I’ve lost three pounds in the last two days alone. I’m still hungry almost all the time, but i just can’t keep the food down. Does this happen to anyone else???",/r/Endo/comments/fktgpa/trouble_keeping_food_down/,submission,2020-03-18 11:33:24-06:00
13,"Severe pain like contractions but not pregnant - endo pain? https://www.reddit.com/r/obgyn/comments/f1illg/endometriosis_or_gi_pain/?utm_source=amp&amp;utm_medium=&amp;utm_content=post_body  I posted this but never got any help on it so I wanted to repost. My original post (the link) is pretty wordy.  Basically, it's been suspected that I have endometriosis but haven't been tested. Different doctors have told me the pain is either endometriosis or GI pain, but nothing conclusive.  The pain is intense and frequent. It will throb and peak, then subside and come back. Based on the many ways I've heard contractions or labor pains described, I can only compare this crippling pain to that. I am not pregnant and finished my period roughly 5 days ago. The pain started 1 day ago. It seems to come within a week of my period ending now, every month. The pain used to be every 6 months and has become more frequent.   Pain originates from right side of pelvis near belly button, but not from belly button. It reaches my right side and the top of my ribs but not as much pain on my left side. It feels like extreme cramps, gas, hunger pangs, and muscle soreness after a hard workout. The pain comes in waves with brief moments without pain, but can last for hours at a time with no break and is so intense that I can't sleep. I use a heat pad, which helps minimally. No meds have seemed to work.  There is no pattern in what I eat causing pain other than if I eat, my stomach will shift. I feel whatever I drink go down my stomach. Urinating and defecating hurt my stomach and core. Feces is softer than normal during this pain, and I don't seem to be as gassy or pass gas as much.  Please help me out! This pain is so crippling, I can't move or breathe. Any position (sitting, laying, standing, crouching, curled up) hurts. I am at my wit's end.",/r/Endo/comments/fkt4qb/severe_pain_like_contractions_but_not_pregnant/,submission,2020-03-18 11:14:08-06:00
14,"Pain at night? Hi everyone,   I don't have a diagnosis for my pain and I'm wondering if my symptoms sound familiar to anyone here.   About 1.5 years ago I started waking up during the night from lower abdominal and back pain. It was limited to night time and would keep me up for maybe 15 minutes on average before it was mild enough for me to go back to sleep. I tracked what food I was eating and found no patterns. I started recording the instances on my calendar to see if there was any pattern and got nothing. I could go two months with no pain, have pain a couple times per week for a whole month, or for a week straight. Just no pattern at all.  There were two instances where the pain was severe enough that I became nauseous, seeing spots, was sure I would throw up (thankfully that hasn't actually happened yet), and was sweating a lot. So much that when I went back to bed, my boyfriend would put his arm around me half asleep and then wake up and ask why I was so wet. That's when I decided to make a gyno appointment.   The gynecologist said what I was describing sounded like uterine pain and during the pelvic exam, she was able to put pressure somewhere that caused a very mild but similar pain, confirming her suspicion that it is uterine pain. Her conclusion: menstrual cramps and take some advil when it happens. This is hard for me to believe though because I had pretty rough periods from the start and my doctor had me start taking the pill continuously in high school (over a decade ago). The cramps stopped and I've been on the same brand for several years. So it doesn't make sense to me that it would just start again out of nowhere. Add on that I could not find any sort of connection to time of month or where I am in my 3 week pill cycle...I just don't buy it. She also had no idea why it would only be at night.   Since then it has continued. There's been another two instances where it was sweaty nausea level pain. The biggest development is it's no longer confined to only happening in the middle of the night. Now I sometimes wake up with it in the morning, and there have been times where it's just come from nowhere in the middle of the day. When it's happened during the day, it's lasted several hours at times. I don't know if this is a change or if it's always lasted this long and I was able to sleep through all but the peak of it.   Does any of this sound like your experience with endometriosis? I haven't had a strong suspicion that that's what I might have because there's other endo symptoms (like pain with sex) that I'm not experiencing... but I'm at a loss so thought it was worth learning more about.",/r/Endo/comments/fkrf7z/pain_at_night/,submission,2020-03-18 09:34:46-06:00
15,"I finally saw a specialist He was one of the doctors on the list that is circling around, I think its nancys? Sorry I forget the name. But I am so happy I saw him. He was validating, never tried to put me on birth control or any of the medications doctors use to put a bandaid over our symptoms. He explained that he specializes in carving out the endo no just burning it. He also asked to get for an ultrasound to figure out where we should go.   I am so amazed at the difference in quality of someone who is an actual specialist.",/r/Endo/comments/fkr3hf/i_finally_saw_a_specialist/,submission,2020-03-18 09:15:02-06:00
16,"My symptoms are unusual? Hi everybody,  I finally went yesterday to get a second opinion about my endo and adeno from the recommended expert in my country. He was quite nice, except for interrupting me all the time and talking more than listening. But I feel that this is a normal problem with doctors.  He said that my symptoms are unusual and I don't understand why, but I couldn't ask him. I wanted your opinion as endo warriors and experts.  **I have:**   Daily pain (moderate to high) in the uterus, lower back pain, left ovary, head, knees and breasts. It used to be only during my periods but now is all the time.  Intense pain during penetration, cramps after orgasm and low pain while aroused. I don't have sex now for obvious reasons.  Dizziness, nausea, 'motion sickness' (similar to motion sickness but experienced while sitting in the sofa/chair). Problems while pooing (as if the poo isn't aiming correctly to the anus) and pain when 'I need to go'. I used to have diarrhoea while in my period.  Extreme fatigue, to the point that cleaning the living room+kitchen last week made me be the next 8 hours shaking in the sofa from the weakness and pain. I suspect that I might have Cfs.  Extremely intense periods (when I had them normally). The last years I had two weeks of spotting + one week of real period. But this is probably due to adenomyosis not endo.  **I dont have:** (He asked me)  Leg pain or pain during urination.  **Background:** 30yo woman with endometriosis (stage 2, he said 'deep endometriosis but I dont know if they are the same), adenomyosis and depression. Possible cfs (I am going to the neuro for that).  What are your opinios, ladies? :)",/r/Endo/comments/fkmvh8/my_symptoms_are_unusual/,submission,2020-03-18 03:33:20-06:00
17,"Being Prepared My girlfriend lost power last week during her period, and I was terrified she wouldn’t be able to charge her heat pack or microwave her other heat pack and would just sit in the dark in pain. Luckily she could still light the stove with a handheld lighter, so she could boil water and use her hot water bottle. Definitely making sure the pain meds are well stocked with this quarantine. How are you making sure you’re prepared for dire circumstances?",/r/Endo/comments/fklw20/being_prepared/,submission,2020-03-18 01:50:12-06:00
18,"Question on Endo! Hello all, I’m new!  I’m A 16 yr old female who’s been in and out of ED in hospital since Nov 2019. On my most previous visit I was asked to come in when I explained to the private system who was cancelling my app on me, the amount of pain I was in and I ended up seeing a gynaecologist during that visit.   I was told I’d need a laparoscopy.   Since then, I have had my app cancelled on me on their end 3 times now with the final being indefinite due to coronavirus (stay safe everyone)   I spoke to a clinic who wasn’t closing due to the circumstance as I thought it was time to try a different clinic.   Via the phone I explained my situation and I was told that I’d be paying $180 for my first consult and from there I’d be directed to a hospital and I’d be put bACK on the airing list for the surgery. I was told even tho I’m going private that I’d be waiting 12 months with additional time due to the coronavirus issue.    Did everyone else need to wait 12 months through private ? I can’t do anything anymore I don’t leave the house without being in agony.    Someone help? This is so disabiling. I’m 16 and school is off the table as is work and even socialising. I’m not sure what to do or if anyone has advice! I live in Adelaide SA",/r/Endo/comments/fklexa/question_on_endo/,submission,2020-03-18 01:03:49-06:00
19,Surgery was cancelled. another few months of carrying this mass of shellacked organs around. Stocked up on tiger balm patches. ,/r/Endo/comments/fkknxi/surgery_was_cancelled_another_few_months_of/,submission,2020-03-17 23:51:27-06:00
20,Thought I’d share something more light hearted for this stressful time ,/r/Endo/comments/fki3u4/thought_id_share_something_more_light_hearted_for/,submission,2020-03-17 20:29:30-06:00
21,"Collapse So I was in hospital on Sunday getting my endo flare under control right. Was released once everything was sorted and came home to bed. The next day I am feeling 1000x times better. Got up, worked out, did some cleaning, did my washing, over all a good day day. Yesterday I woke up, still feeling great so I did some more cleaning, got my new bed frame and put it together and then went out to the garage to sort some stuff. As I was walking out of the garage everything from the waste down stopped working and I collapsed. Ended up spraining my left ankle again (did it a month ago as well, had an endo flare that I pushed myself through a little too much and fell down some stairs), tendons or ligaments in the right foot are tender. Left knee is sore. Grazed skin on both legs. Hips are hurt as well as wrist from falling/landing on them. Have been put on crutches to help with walking since it didn’t heal properly the first time and wrist a little sore from holding those. And then last night at about 4am I am woken up crying and pretty much screaming (I remember that I made some weird sounded noises but not sure if it was screaming or just loud) (also I was home alone) because my body was going through contractions. This happened for about 2 hours before it subsided enough for me to be able to go to the bathroom. Decided to take a clean pair of underwear and a pad just in case and it was a good thing I did cause there was so much blood on my inner thighs, thick clotted blood on my underwear and I was still pouring out blood while on the toilet. Let’s just say R.I.P to that nice beautiful pair of underwear I was wearing, they were my favourite and now they’re destroyed. I’m not supposed to have my period and there were no signs that my body was going to start this. Today I just have a splitting headache from the loss of blood and very little movement I’m able to do to keep hydrated. But does anyone else get this? Just random episodes with no warning? Does anyone else go through contraction like pains when passing blood? Or just passes clotted blood which a lot of my “periods” are?",/r/Endo/comments/fki0lf/collapse/,submission,2020-03-17 20:23:24-06:00
22,"Flare Up Due to COVID-19 Anxiety Is anyone else having a really bad flare up due to coronavirus anxiety? I have contamination anxiety (and suspected OCD), so while I’m trying to be logical about this whole ordeal, it’s hard. I’ve always noticed that my anxiety worsens my pain and this is no exception. I’ve been self isolating, and I’m in a low infection zone (as of right now, at least), but that’s not stopping the pain caused by stress. Ironically, I haven’t been able to get in with any form of therapist or psychiatrist yet due to coronavirus precautions. How’s everyone else holding up?",/r/Endo/comments/fkhsvz/flare_up_due_to_covid19_anxiety/,submission,2020-03-17 20:08:20-06:00
23,"Orlissa and constant sweating Did anyone on orlissa sweat CONSTANTLY? I don’t mean hot flashes I mean you’re constantly sweating all day you’re drenched in sweat. It’s been a week or so of this. I’m a few days away from a month on this drug and feel no improvement in pain. If you’ve taken it can you also please tell me how long before you saw improvement? It’s also really affecting my appetite  Also I realize complaining about sweating during a literal pandemic is probably very annoying, but if it’s not an orlissa thing then I prob need to call my doctor and be like “wtf is wrong with me”. Thinking of all of you and hoping you stay healthy. I remember counting down the days til my endo surgery, so for those of you who have had them cancelled, my heart really goes out to you. It would’ve been devastating to me.   Stay safe everyone!",/r/Endo/comments/fkhffj/orlissa_and_constant_sweating/,submission,2020-03-17 19:42:08-06:00
24,"Are you undressed and in gynae stirrups during a laparoskopy? I'm unsure what to visualize what is going to happen between when I arrive at the hospital and when I'm going home. There is lots of information about what to do the day(s) before, and procedure part itself, but not much on what the patient is told to do AT the actual hospital.  Any insight?",/r/Endo/comments/fkgoel/are_you_undressed_and_in_gynae_stirrups_during_a/,submission,2020-03-17 18:50:53-06:00
25,I went 88 days without a period! 😱 On Dec 31st I had my left ovary and a giant chocolate cyst removed. I finally got my period after 88 days! I was starting to think it was never coming back. My doctor said my right ovary should pick up the slack and my periods should be just fine. Boy was she wrong!   The first few days it was light but now it's like a flood! On the plus side all the chunky brown discharge is gone.  Has anyone else had this problem?,/r/Endo/comments/fkg7xh/i_went_88_days_without_a_period/,submission,2020-03-17 18:20:44-06:00
26,"Anyone with migraines and rheumatoid arthritis or autoimmune diseases want to share their experience using birth control to treat endo? I’d love to hear about all treatment experiences with migraines and rheumatoid arthritis. From the research I have done, there are risks with each type. I have done terribly with combined hormone BC in the past and haven’t tried anything else because I’m scared. My endo like (awaiting dx) symptoms are interfering with my life so at this point I have to try something",/r/Endo/comments/fkdvps/anyone_with_migraines_and_rheumatoid_arthritis_or/,submission,2020-03-17 15:52:42-06:00
27,Post-Lap: sleeping troubles ,/r/Endo/comments/fkcid5/postlap_sleeping_troubles/,submission,2020-03-17 14:32:01-06:00
28,"What does this test result mean? I had an ultrasound last week. The hospitals are obviously swamped and my doctor did not call me to explain my results. She wrote one sentence: ""endometriomas on ovaries bilat 5cm and 3cm as well as thickened endometrial stripe.""  Does anyone know what this means? Does this show that I may have endometriosis? I will try calling my doctor as well, but I know it may take over a day to get a response.",/r/Endo/comments/fkbhlc/what_does_this_test_result_mean/,submission,2020-03-17 13:34:01-06:00
29,"What to expect after surgery? After a two and a half year battle to get diagnosed, I finally saw a specialist today who’s booked a diagnostic surgery next week, and is going to remove whatever endo he finds.  From your own experiences, what should I expect during recovery?",/r/Endo/comments/fka9f0/what_to_expect_after_surgery/,submission,2020-03-17 12:25:27-06:00
30,Virtual Meet-Up Tomorrow on Zoom! ,/r/Endo/comments/fk94qn/virtual_meetup_tomorrow_on_zoom/,submission,2020-03-17 11:23:08-06:00
31,Praying for all you warriors having surgeries canceled. Stay strong! 💖 ,/r/Endo/comments/fk8csv/praying_for_all_you_warriors_having_surgeries/,submission,2020-03-17 10:39:02-06:00
32,"What has been the most effective birth control brand for your Endo pain? Hi! I also posted this question in r/endometriosis only because my appointment is in three hours, so I figure the more visibility, the better.  I've had a laporo, and I have tried at least a dozen different types of NSAIDs and painkillers. Don't ask me why because I have no rational reasoning, but I have always been afraid of birth control, so I have never given it a fair shot.   However, I am sick of taking opioids, I took Orilissa for one day and then the research I uncovered terrified me into never taking it again, and my gyno has said a hysterectomy is not something he feels comfortable doing until I have exhausted all options (which I agree with), so birth control is where I am at.  I have an appointment this afternoon, and while I am Googling info, I figured you ladies have been on the frontlines and would be able to tell me what's worked for you (and what hasn't).  So... best, worst, side effects, anything else? I have full coverage if that matters.",/r/Endo/comments/fk6vbv/what_has_been_the_most_effective_birth_control/,submission,2020-03-17 09:11:23-06:00
