,text,link,type,created_mst
33,"Advice Needed: Having an increase in symptoms and doctor can’t see me due to coronavirus Background: I was formally diagnosed with Endo in October following a laparoscopy, they also lasered off a lot of endo tissue while they had me opened up. This was after 5 years of symptoms and fighting to be taken seriously. Some of the worst symptoms (which are tmi but relevant) were severe rectal bleeding and (sword up the arse like-) pain, unbelievable cramps and prolonged bleeding which could last several weeks and at times lasted over a month. I also had a cauda equinas (3 discs collapsed inward onto my spinal cord) compression 6 years ago which required surgery and left me with permanent nerve damage and I’m technically disabled now even though I’m still not comfortable stating that, during this time my periods stopped entirely on their own for over a year. I currently have a cold and as I’m also a severe asthmatic I am self-isolating.  I have not had a period since my surgery in October, my gynae advised me to wait until around May to have a period and advised me to come back if any symptoms returned. For the last several weeks I’ve been bleeding daily, the blood is very dark, and then I started bleeding rectally again and the pain returned as severe as ever. My GP is not seeing anyone amid the pandemic, I also can’t see my gynae and I’m at a loss as to what to do. I know the next stage of the plan is hormone injections but it could be a long time until things get back to normal and I can get the treatment. Has anyone dealt with something like this before? I’ve been taking the pill continuously but seeing as I’ve been bleeding and getting cramps regardless I’m wondering if I need to let my body have a period, even if it is really bad. I’m terrified of the pain but I feel like my body needs it.  I’m hoping there’s some people here who’ve experienced something similar and could give me some advice on what to do.",/r/Endo/comments/fk5vd3/advice_needed_having_an_increase_in_symptoms_and/,submission,2020-03-17 08:09:40-06:00
34,"Top Endo Questions? Hey y'all -  With all the craziness of coronavirus, we've got some extra time inside. We're hoping to pull together our network of experts (ie Nook approved OBGYNs, nutritionists or pelvic PTs specializing in endo, whoever we need!) to answer some burning questions that people with endo have. With cancelled surgeries &amp; clinics, they might have more time on their hands, too.  What are some of your biggest or most burning questions? We'll try to get to as many as possible.   Thanks so much and stay strong.",/r/Endo/comments/fk5npx/top_endo_questions/,submission,2020-03-17 07:55:52-06:00
35,"Why so many of your surgeries are being canceled/postponed The American College of Surgeons released this recommendation a few days ago, I can only assume other countries are similar.  I'm sharing this here to help manage expectations and help others better understand that your surgeons are doing the best they can in these times.",/r/Endo/comments/fk4lfj/why_so_many_of_your_surgeries_are_being/,submission,2020-03-17 06:43:17-06:00
36,"GnRH treatment experiences? Hey 👋   I was diagnosed with endo Jan 2019 via laparoscopy and the last 6 months have been having issues again (worth noting I also have PCOS).   I have been told by my gynaecologist today that another laparoscopy is on the cards, but they want me to try the GnRH injections first. I’m 22 years old, I don’t know a lot about what they do but apparently they make your body think it’s going into the menopause which is something I’m not 100% certain I want to do.   Would be great to her peoples thoughts/experiences!!  TIA x",/r/Endo/comments/fk3573/gnrh_treatment_experiences/,submission,2020-03-17 04:43:25-06:00
37,"Didn’t receive the Lupron injection. Hello pain, my old friend. Last time, the injection was shipped to my home. When I went in to the office to have it done, the doctor said he would have it shift off to the office for convenience. Called them yesterday (the day of my appointment), and they hadn’t received it either. And now my pain is coming back. It’s okay I guess. Most of the time it’s tolerable. I’m going to call them this morning and see if I should be out back on birth control since we don’t know when I’ll get the injection. Not that it helped much, but at least it kept me from getting pregnant. Guess I need to dig out my heating pad from the depths of my closet. Wish me luck y’all.   Don’t mean to be a Debby Downer. Y’all are warriors and bad ass women for putting up with the pain and having to shop around to find someone who will actually listen to you. Much love ❤️",/r/Endo/comments/fk34oo/didnt_receive_the_lupron_injection_hello_pain_my/,submission,2020-03-17 04:42:02-06:00
38,"does this sounds like endo? This is my first time posting here and i’m on mobile so bear with me for the format. I’m not officially diagnosed yet but I just want to get some insights from people so :-)  To begin, my symptoms started sometime last year when I had really painful bowel movements during my period, to the point that I almost fainted in the toilet.   I did went to see a doctor for this but they just gave me constipation meds and to just take normal painkillers. Also, my painkillers does not do much to the pain.   Apart from the painful BM, I do get these butt cramps? from time to time during my period, like they are sudden and have caused myself to be bedridden for a few hours on several occasions.  My latest update to my symptom list is having cramps when I’m not on my period, like I am having this dull aching feeling on my lower abdomen and I’m only halfway in my cycle and it has been happening for 4 days straight already.  I’m already making plans to see a OBGYN in May or as soon as possible and I just really am so tired of this already.   Sending my love to everyone fighting endo! &lt;3",/r/Endo/comments/fk1ppn/does_this_sounds_like_endo/,submission,2020-03-17 02:28:54-06:00
39,"What works for you? Because I'm running out of options... What do you do when you're having a flare up? Does anything bring you relief that I'm missing?  I keep ending up the the emergency room, where they keep telling me I need to get my obgyn to take care of it, but my obgyn keeps pushing me off to the ER and the cycle continues.  To avoid a hospital visit I try: - heating pads and microwave hot packs - Stretching and pressure from a yoga block - hot showers - boiling hot baths (my s/o literally boiled pans of hot water for me to keep the bath warm for hours) - my boyfriend takes me for drives so I can scream and cry without disturbing anyone in our building - Tylenol and Ibuprofen combo - all different kinds of laying/sleeping/sitting positions  Nothing helps.  I'll have spells that last anywhere from 3-12 hours before I'll beg my boyfriend to bring me to the hospital or before he decides he just has to take me. This can happen for days to weeks at a time.  At this point my doctor has given me a limited supply of opiates, which are a last resort to manage pain, and only the strongest ones really touch the pain and I can't take them forever.  Any suggestions!?",/r/Endo/comments/fjzstd/what_works_for_you_because_im_running_out_of/,submission,2020-03-16 23:28:03-06:00
40,"Endo Awareness Project I’m doing a project to raise awareness for endometriosis, as well as provide resources and facts. I’m having trouble coming up with a catchy title for the project, so I’d appreciate any suggestions! :)",/r/Endo/comments/fjx8pt/endo_awareness_project/,submission,2020-03-16 20:14:22-06:00
41,"Stopping smoking and Endo Hi,  I never had exploratory surgery so my diagnosis is not exactly confirmed. However, the pain related to my period and ovulation disappeared slowly after starting hormonal birth control (Mirena) which was suggested by a doctor as treatment. Unfortunately, after approximately a year the pain started to come back slowly in a regular fashion. I don't have any periods anymore so it's hard to tell but I write a health diary and for about 4 days a month I'm in pain. After being on lots of pain killers before I got the Mirena I try to avoid taking them as much as possible now and the pain is still bearable...  13 days ago, I stopped smoking and ever since I stopped I'm in constant pain. Constipation and pain ""on"" or close to the intestines are a major factor in my ""normal"" Endo pain and I'm experiencing a lot of this. I know that the constipation increased because I stopped smoking but this is slowly getting better and the pain moving towarss the uterus without any decrease in the pain.  Did one of you stop smoking and could share their experience? I'm starting to get a bit worried actually. I've been moving countries a lot and don't have a trusted gynecologist at the moment.  Any advice would be appreciated!  PS: I hope you can still make sense of my rambling... I'm new to this subreddit and pretty bad at describing my symptoms.",/r/Endo/comments/fjv8q8/stopping_smoking_and_endo/,submission,2020-03-16 17:58:32-06:00
42,"Possible Endo diagnosis and kinda freaking out. Hi everyone. On mobile so apologies in advance for the formatting. Yesterday I went and had my Mirena reinserted after having to have an emergency procedure to have it removed a few weeks ago (got unlucky, it moved side ways and wedged hard after 6 months) and they did exploratory lap because I have still had a bit of lower right pain on and off, not to mention still bleeding through the Mirena (no where near as bad as before the Mirena though). Thought maybe a cyst because I’d had one before and since I was going under anaesthetic why not check it out.   Anyway, the Gyno was really concerned and cagey when I came out and in recovery and said my ovaries were really angry looking and they have sent biopsy away to confirm potential Endo and maybe something else... but I kinda tuned out because I didn’t think I even had - quarter of the symptoms of Endo. I have NEVER had painful periods. Like ever. Maybe the odd cramp that would maybe edge 4/10 but pop a Panadol and go on my way. Sure I’d bleed for 40 ish days on and 10 days off and repeat but I’ve recently been diagnosed with a Prolactinoma (brain tumour in the main hormone gland) so I thought that came down to that.  I’ve been experiencing painful sex - to the point I kinda stopped wanting to have it. The nurse did let me see the pictures when I got back to the ward and the do look similar but with a lot larger black lumps than my friend who has really bad Endo but I’m trying not to jump to conclusions but I’m kinda really freaking out because I have been told nothing. Like Endo wasn’t even on the cards really for me so nothing has been explained and What I have read sounds so terrible and all the things I’ve glanced here I just feel so horrible and guilty for even posting this but I just need some kind of reassurance or something.   My biggest desire in life is to have children. Like be pregnant when the time is right and actually had a kid. The guy I’m currently dating (and looks really promising to have a future with) wants kids to. My brain tumour is already going to make that a battle apparently and I just don’t know what I’m going to do.   I was lucky my procedure wasn’t canceled (they literally canceled all days after mine) and there isn’t any actually follow up except for skype ones now because of Covid-19, which is also going to delay the lab reports apparently.   I’m sorry this is so long.",/r/Endo/comments/fjs2el/possible_endo_diagnosis_and_kinda_freaking_out/,submission,2020-03-16 14:45:44-06:00
43,All the symptoms of inflamed gallbladder and/or gallstones. Ultrasound results show I’m super healthy inside. So why am I in so much additional pain to my usual endometriosis symptoms? And why do both areas flare up like crazy together? Nobody seems to want to help me at hospital. General surgeons and abdominal surgeons have now shrugged and told me to get gynae to help me. Gynae don’t want to deal with any pain above the belly button. Agonising pain for three months and no sign of improvement. Not even tramadol and morphine are stopping the upper abdominal pain. Pelvic pain only just under control.   How is this my life? Please help. 💛  Original post: https://www.reddit.com/r/Endo/comments/fdkyfh/gallstonesgallbladder_issues_right_upper_quadrant/?utm_source=share&amp;utm_medium=ios_app&amp;utm_name=iossmf,/r/Endo/comments/fjqebk/all_the_symptoms_of_inflamed_gallbladder_andor/,submission,2020-03-16 13:06:18-06:00
44,"Trouble reading CDC link on Nancy's Nook/Concerns on getting pregnant during outbreak Just got off the phone with a specialist for the first time(it was an initial visit turned phone conference due to coronavirus cancellations). She gave my husband and me her blessing to start trying for kids but with an excision surgery in the books for later this year if we have troubles.   After the phone call I saw a post from Nancy's Nook that mentioned "" CDC suggests defer getting pregnant at this time,"" with this link : https://www.cdc.gov/coronavirus/2019-ncov/hcp/index.html?fbclid=IwAR2JcsY_iA-iPc2MtlVSxQKDw6r7Clo-j5mQnJMaDJViaw9mP8LdsfGct4Y   I see the section on precautions to take if you're already pregnant, for new mothers in the hospital, transfer from mother to baby, etc.,  but I'm having trouble finding anywhere in the link that says women should refrain from getting pregnant.   I mean, there are obvious concerns such as needing medical visits once pregnant, taking up beds and whatnot, but does anyone know if that's the main reason? Do I have the big dumb and completely missed the quote she was referring to? Figured a second set of eyes might help.",/r/Endo/comments/fjmfae/trouble_reading_cdc_link_on_nancys_nookconcerns/,submission,2020-03-16 09:09:03-06:00
45,"Sure I’m not the only one - Surgery canceled I know I’m not the only one, but my fucking surgery just got canceled. I have been waiting four months for this date and have continuously had high counts of blood in my urine and still, canceled. I know there are plenty of us going through this exact heartbreaking scenario. Please stay safe and take care of yourselves. My DMs are open for anyone who needs to talk. ❤️",/r/Endo/comments/fjmczc/sure_im_not_the_only_one_surgery_canceled/,submission,2020-03-16 09:04:48-06:00
46,A podcast from UK Royal Institution on Endometriosis (research-oriented) ,/r/Endo/comments/fjliit/a_podcast_from_uk_royal_institution_on/,submission,2020-03-16 08:08:27-06:00
47,"Tips for gyne app  Hi ladies. I have my second gyno app this afternoon, I'm in the UK so the referral and now follow up from my GP took about a year!! couldn't have come at a better time because I'm cramping and have been breakthrough bleeding for about 2 weeks now!   The first appointment didn't go as well as I hoped. He essentially told me it was all in my head because of trauma, but I know it's not. Trauma wouldn't cause urinary symptoms?!  He suggested last time that I only take a break on my pill every 3 months, in stead of never which is what my GP told me to do. That's all he did (besides tell me it's in my head lol)  I need some tips/support/advice how to go into this appointment and stay strong- I always say I'm going to out my foot down bla bla but as soon as I'm in the room it's like I turn into a thank you robot and cant stick up for myself at all and get so anxious, I just want to get out of there. How do I do it!?",/r/Endo/comments/fjli51/tips_for_gyne_app/,submission,2020-03-16 08:07:44-06:00
48,Question on spreading ,/r/Endo/comments/fjlfs0/question_on_spreading/,submission,2020-03-16 08:03:24-06:00
49,"Could really do with some advice! Post lap and Merina coil So about 2 and a half weeks ago I had my first lap and the coil put in at the same time. I’ve been on a pretty steady mend and have been shocked by how quickly I recovered!   I’ve been on my period since Tuesday last week but it’s been barely any bleeding. Pretty much all dead blood when usually I’m used to a week of continuous very heavy bleeding.   I also haven’t been in too much pain on this period until today. Since the initial surgery pain wore off I’ve been able to get by with little to no meds. Today I’ve taken everything I can without making a death cocktail and I’m still in too much pain to walk.   It sucks! It’s sunny and I want to be proactive. Do I need to call my GP? I’m worried this could be a coil issue. I know there’s a chance this could be my body rejecting the coil but it could also be something worse. If anyone has any advice I could really use some, thanks",/r/Endo/comments/fjiabv/could_really_do_with_some_advice_post_lap_and/,submission,2020-03-16 03:32:42-06:00
50,"Does anyone else remember childhood pain? Recently I came across a study that mentioned pain occurring pre-puberty, as early as 9 in patients with endo. It really resonated with me because I remember having sudden middle of the night cramps which would last for hours and not go away no matter what I did, starting around 8 or 9. It didn’t really occur to me until recently that this was anything other than constipation (to be fair some of it probably was). But i think most people don’t remember this happening at least every couple of months for years on end...including times when I threw up from the pain or wasn’t able to walk upright. Tbh i wonder why my parents didn’t think it was weird. A lot of my worst endo pain happens all of a sudden in the middle of the night :( stuff like this makes me think about how much of my life has been permeated by this disease and the lack of awareness. I feel like I’ve only recently (post excision) begun to accept that, I don’t think I could handle it before to be honest. Denial is definitely a coping mechanism.",/r/Endo/comments/fjhoau/does_anyone_else_remember_childhood_pain/,submission,2020-03-16 02:29:53-06:00
51,Anti-inflammatories may aggravate Covid-19 ,/r/Endo/comments/fjhjsv/antiinflammatories_may_aggravate_covid19/,submission,2020-03-16 02:16:43-06:00
52,"Could Weight Loss be Making Endo Pain Unbearable? As background, I was diagnosed with endo around age 18. I am 27 now and haven't had any surgery since the laproscopy that gave me a diagnosis. Back then my periods were debilitating, but over time got better.  My period usually lasts 4 days, the second day being the worst always, but they're not debilitating these days.  I have been in the process of losing weight for a few months now. I'm not any any type of strict diet, just limiting my calories/carbs and being more mindful of foods I'm eating. Over the past year I attempted to diet and would only do so for a couple months before falling and out of it. During this time I noticed my periods tended to be worse as well, leading me to think weightloss may be the common theme.  The past 3 months my periods have been excruciating, worse than I remember them being in my late teens. I'll speak about my most recent experience with this, noting the previous month went about the same.   I started early Thursday night, woke up Friday early morning in extreme pain. I took OTC ibuprofen but it did nothing and I literally could not move from a folded over position, similar to child's pose in yoga, without screaming. This went on for hours until I finally passed back out for a couple hours. When I woke up I still could feel the pain but I was at least able to move around and get to work at some point. Throughout the day I felt twinges here and there but nothing compared to the pain earlier in the day.   My question to all of you is could this be related to weight loss?   I'm not finding many articles on this issue, just how weight loss should make endo better, not worsen like this. Looking forward to at least hearing I'm not the only one this has happened to because right now I feel torn between trying to reach a healthy weight and giving up for the sake of not being in pain.   (Yes I plan on going to the OBGYN soon for a professional opinion)",/r/Endo/comments/fjcv1r/could_weight_loss_be_making_endo_pain_unbearable/,submission,2020-03-15 19:43:57-06:00
53,"Period after surgery &amp; more pain? So I just had my diagnostic surgery this past Wednesday, and apparently my doctor had to remove a lot of endo from the right side. I have 4 incisions, the lower left &amp; right, through the belly button and one about belly button height but a bit to the left. Anyway, I just got my period today, and I've been feeling a bit better with recovery, but now that I have my period its really hurting on my lower left side. I did a bit more than I usually have been, trying to push myself the healthy amount. But I did notice some increased pain on the lower right incision too.   Is any of this normal to have when you get your period right after surgery?",/r/Endo/comments/fjc72i/period_after_surgery_more_pain/,submission,2020-03-15 18:58:15-06:00
54,"I had no idea that Halsey has endo and even does advocacy for it. She spoke at the Endo foundation of America, blossom ball, and tells the story of experiencing a miscarriage while on tour. ",/r/Endo/comments/fjbm2v/i_had_no_idea_that_halsey_has_endo_and_even_does/,submission,2020-03-15 18:19:27-06:00
55,"Fever with IUD? I just had a new IUD put in on Monday and I’ve had cramping and bleeding (I’m stage 4 endo so i expected it to be a painful one) but it hasn’t stopped hurting yet. Today I have a fever of 101, and no symptoms of coronavirus— have literally been quarantining for 2 weeks already bc of endo pain and I work from home. Only symptoms are pain, cramping, bleeding, and feeling crazy irritable from pain. I’m pretty positive that it’s not placed improperly. I switched from Mirena to Liletta so I’m wondering if my body is just uncomfortable because of that? Dr office is closed today and I’m in LA so urgent care is looking unlikely.   Anyone have anything similar happen?",/r/Endo/comments/fjb967/fever_with_iud/,submission,2020-03-15 17:55:28-06:00
56,Did anyone's period cramps suddenly get worse and that's when they got diagnosed? ,/r/Endo/comments/fja122/did_anyones_period_cramps_suddenly_get_worse_and/,submission,2020-03-15 16:39:02-06:00
57,"Surgery found no endo, still have symptoms ",/r/Endo/comments/fj90mi/surgery_found_no_endo_still_have_symptoms/,submission,2020-03-15 15:34:30-06:00
58,Did anyone have worse pain when conceiving? Or anything distinctly different that someone without endo might not experience? ,/r/Endo/comments/fj8zsv/did_anyone_have_worse_pain_when_conceiving_or/,submission,2020-03-15 15:32:56-06:00
59,Supermarket completely out of painkillers due to hoarders. I hate people. ,/r/Endo/comments/fj8bmm/supermarket_completely_out_of_painkillers_due_to/,submission,2020-03-15 14:51:49-06:00
60,"Anyone interested in doing a book club/support meeting? I was attending a class based around a book called Living a Healthy Life with Chronic Conditions, but the class was cancelled for COVID-19. I really enjoy the support and the weekly goals/check-ins. Would anyone want to participate in a free form support class where we voice chat?   The book I am reading is this one: https://www.bullpub.com/living-a-healthy-life-with-chronic-conditions-4th-edition.html",/r/Endo/comments/fj3nkf/anyone_interested_in_doing_a_book_clubsupport/,submission,2020-03-15 10:11:02-06:00
