,text,link,type,created_mst
87,"Yet another silly roadblock to treatment I finally found a doctor willing to do a lap after being turned down by two different ones. But now I have the most ridiculous roadblock.  My insurance doesn't cover surgery, so, per the nurse I talked to, I can't schedule until I get approved for financial assistance with the hospital. No problem, right? I've done financial assistance at another hospital and they approved me in under a week.  Well, this hospital apparently has different requirements. When I told the previous hospital that I make too much for Medicare, they took that requirement off of my application. This second hospital, though? ""We still need you to apply for Title 19 first so we have the decision letter.""  This is the biggest waste of time on the planet. The cutoff for Title 19 in my state is $15.5k/year. I make $18/hr, so almost double that cutoff annually. It's a waste of time and resources to make me apply for this. It's a waste of time for the poor bastard who has to review my bullshit application. And it means that someone who actually NEEDS Title 19 has to wait while said poor bastard reviews my joke application. It's a waste of the paper they're going to print my ""bitch, are you KIDDING???"" denial letter on.  And if that's not ridiculous enough, the decision can take up to *45 days*. I was referred to this surgeon because I went to the gyn asking for solutions after I had ovarian cysts burst 2 weeks apart despite being on both Nexplanon and Lupron. Now I have to wait close to two months to even *schedule* my surgery because of this bogus requirement, and I'm still having constant ovarian pain. It's really feeling like some force in the universe just wants me to suffer.",/r/Endo/comments/fhzkpb/yet_another_silly_roadblock_to_treatment/,submission,2020-03-13 07:23:26-06:00
88,Laparoscopy (removal endo/ cyst) - no sex drive I had surgery 6 months ago to remove a large ovarian cyst and endometriosis. While recovering I ate my emotions and I put on weight. I have lost all sex drive and am very depressed. I suspect my hormones are going wild and I have heavy periods. I don’t know what’s wrong with me. I just keep gaining weight. It’s been 6kg (about 13lb) in the last few months and I was already just slightly overweight pre surgery. I haven’t felt myself in about a head and it’s affecting my marriage. Does anyone know how long this post surgery feeling will last? I am 39 years old.,/r/Endo/comments/fhxx0s/laparoscopy_removal_endo_cyst_no_sex_drive/,submission,2020-03-13 05:05:44-06:00
89,"A professional listened and believed me. Hello all, I just wanted to tell my little success story and maybe give some of you hope as well.  During the time I've been dealing with my endo, I've been dismissed a lot. First, my symptoms were normal. Then, my endo wasn't that bad, my symptoms couldn't be that disabling. Then, I'm ""healed"" after ablation surgery.. And all the while having a psychotherapist who didn't believe my awful experience. Then I reached out to another psychotherapist who wanted to diagnose me with a somatoform disorder.  And after all that crap, finally, I found somebody who is disabled themselves. For the first time, somebody listened and just believed me. Gave me compassion. Even told me that they thought I was really reflected for knowing I don't see children in the future and that my quality of life is more important then having a uterus (I also have adeno). That person understood my agony with medical staff, because.. Well that person is affected by it too.  I would highly recommend all of you to reach out to psychotherapists or medical staff with disabilities/chronic illnesses themselves. It is life changing.  After that experience, I walked home in pain. That person could not take away my pain, but they made it so much more bearable by believing me.",/r/Endo/comments/fhw7v5/a_professional_listened_and_believed_me/,submission,2020-03-13 02:05:20-06:00
90,"For all you uterus-baring people who are yet to be diagnosed... Here’s my 1 in a million story:  Since I was about 14 years old I have been experiencing hormonal-related migraines (uncomplicated type). I went onto the contraceptive pill at the time which somewhat managed my migraines. In most other ways, I was seriously fortunate to have relatively light periods of about 3-5 days. I rarely experienced cramps, maybe the mild ‘twinge’ every now and then. After my 18th birthday (the usual age in Aus for first Pap smear/test), I went off to have my first Pap test. The brush against my cervix was excruciating! My GP acted promptly and sent me off the gynaecologist. Within a month I had a laparoscopy, for which I was diagnosed with stage 3-4 endo and also had a mirena inserted at the time. I am also one of the very small percentage of women who don’t have a period with a mirena, and it’s been 4.5 years! Unsurprisingly, my migraines also stopped after this.   The reason why I’m telling my story is not to brag or gloat. I am actually extremely grateful and fortunate in my position. I wish majority of other women experienced endo in the same way I do (though I don’t wish it on anyone at all).   I want to encourage you not to ignore your symptoms, because it is a TOTAL MYTH that you must be completely disabled by your symptoms! Yes, some of us experience very few symptoms with very widespread endo. Others experience very serious pain with mild endo. You CANNOT diagnose or see endo with an ultrasound, don’t let anyone tell you otherwise.   Don’t fuss over symptoms, etc. Please just have your laparoscopy. Also, don’t read mirena horror stories, most of my friends have one and love it!",/r/Endo/comments/fhw3on/for_all_you_uterusbaring_people_who_are_yet_to_be/,submission,2020-03-13 01:52:20-06:00
91,"Mirena &amp; Endo Help Please! Hi! Ok sO, here’s the long backstory: my family has a serious history of endometriosis and I had some wildly unpredictable periods when I was a young teen- one was three weeks long at fourteen and one would be three days. So my mom got me the mirena, and my first one was perfect in every way. The summer I turned 19 I had it removed and a new one inserted. The following thanksgiving, I began getting really bad PMS symptoms, terrible sharp cramping, around Christmas I began having insane boob pain- searing pain and rope-y feeling boobs.... it just seems to be so unpredictable, some weeks just terrible PMSing and then random bleeding thrown in, and my partner says he hasn’t felt the strings since the last couple months. Putting in tampons used to hurt really bad, and fingers in me still do, so I’m terrified of checking myself... I have an appointment with my general doctor in a couple weeks, but should I be more concerned?  Here’s a LOT of iud horror stories, and I’m just wondering if some weird boob pain really means I perforated my uterus or something (i might be a hypochondriac, yikes)",/r/Endo/comments/fhtxhb/mirena_endo_help_please/,submission,2020-03-12 22:18:13-06:00
92,"Diagnosis Depression Hey all. I'm a 22 y/o and just had my first laparoscopy to diagnose endo a week ago tomorrow. Going into it I was afraid they wouldnt find anything, and I think even my doctor was skeptical of finding much. Turns out I have severe endometriosis that presented as adhesions connecting my uterus to my bowels, intestines, colon, and appendix. The doctor said it looks like someone dumped super glue in me, and that hes surprised I havent been on disability for years. Today at my one week post OP he told me that hes already referred to my story 3 times when talking to other patients about severe endo.   The thing is, I thought I would be ""happy"" (more like relieved) to have an answer. My pain can't be denied anymore. And I was at first, but now I just feel so depressed. The reality that at only 22 years old I'm diagnosed with a chronic disease. That the only options in front of me are orilissa, lupron, or more years of pain. That I may have difficulty getting pregnant when the time comes and I'll I've ever wanted in life is to be a mom one day. I just want to be normal. And I dont know how to cope with all of this.   Sorry for the rant, just needed to vent...feeling like I'm in a dark head space",/r/Endo/comments/fhtlo9/diagnosis_depression/,submission,2020-03-12 21:52:12-06:00
93,"My October surgery was just moved to April!!! I was super bummed recently that my laparoscopy/hysteroscopy was booked all the way in mid-October, as I have finally reached a breaking point with dealing with the constant pain every single day. But after calling my hospital and having a chat with the admissions office, they let me know that a date had just opened up in Mid-April and were happy to move my surgery forward to then.  I'm so relieved! I honestly can't wait to have this surgery done, for steps to be taken to actually fix this. Its weird to say about a surgery, but I'm so excited and happy. I wanted to share the news with some people who would understand why such a close date is a matter to be so pleased about.   Sending you all my love and support, guys, and wishing you such good luck too!",/r/Endo/comments/fht1lu/my_october_surgery_was_just_moved_to_april/,submission,2020-03-12 21:08:26-06:00
94,"I’m having my first ever diagnostic laparoscopy soon I haven’t officially been diagnosed with endometriosis yet, but all the doctors I’ve seen recently agree that with my symptoms I probably have it. So we’re scheduling a laparoscopy, and I was hoping for some advice and tips on how to make this go as smoothly as possible!",/r/Endo/comments/fhrt6m/im_having_my_first_ever_diagnostic_laparoscopy/,submission,2020-03-12 19:40:00-06:00
95,Cute lil pin for us ,/r/Endo/comments/fhqkqj/cute_lil_pin_for_us/,submission,2020-03-12 18:14:42-06:00
96,"Starting pelvic floor therapy... feeling not hopeful Ugh. Ladies. Guys. It’s been one hell of a road. I’ve been in chronic pain for way too long, days turn to weeks and I’m beginning to count the months. I can’t seem to remember the last normal pain free day I’ve had. I wake up every morning between 2-4am. Every. Single. Day. With pain, bowel pain, and hunger pain.  I had my lap December 2019, performed by a specialist whom I found to trust during this adventure when no one else listened. She described it as very extensive, all over my bowels and that in her opinion I had it in the worst places to have endometriosis. Thankfully she said she was able to remove it all and aggressively treat it by ablation. I was diagnosed at stage 2-3, more on the 3 side. I was so hopeful that my pain would reside but it didn’t. I kept calling and complaining of abdominal and pelvic pain. Although I don’t get a monthly period due to the progesterone I’m on, I still get symptomatic period pains monthly. The pain is so severe I vomit, get light headed, nauseated, pain so severe I can’t walk, my back throbs and all I can do is cry my heart out. Finally I was scheduled to do an abdominal CT and pelvic scan with iodine and contrast.  Nutcrackers syndrome is what they call it. Few days after my CT scan my specialist calls me and tells me the results and tells me to google it because they have never heard of it. What a disheartening feeling. I guess since they don’t know what to do with me they send me to pelvic floor therapy to help. I feel so alone. I was told this is rare and I’m just unsure how this pelvic floor therapy is supposed to help this vascular issue. Sorry for the venting but I thought I would be more excited for pelvic floor therapy once the time came... and now I don’t know If I’m going down the wrong path to fix my pain 🙁",/r/Endo/comments/fhq8so/starting_pelvic_floor_therapy_feeling_not_hopeful/,submission,2020-03-12 17:51:48-06:00
97,Successful appointment ,/r/Endo/comments/fhq8dn/successful_appointment/,submission,2020-03-12 17:50:58-06:00
98,Endo Specialist Recommendations? ,/r/Endo/comments/fhnbbs/endo_specialist_recommendations/,submission,2020-03-12 14:48:06-06:00
99,"My long-awaited excision surgery set for tomorrow morning was canceled and I'm so depressed This was my worst fear. They did not say it was due to COVID-19, but that my doctor just called in sick. I hope she has a speedy recovery and will be okay.  I'm currently so depressed and my heating pad is super glued to my body. I am really hoping my cyst doesn't burst. There is currently no reschedule date. Just needed to vent somewhere people would understand.",/r/Endo/comments/fhna8c/my_longawaited_excision_surgery_set_for_tomorrow/,submission,2020-03-12 14:46:14-06:00
